{
  "key": "TASK-019",
  "title": "Template-prep command — produce a pristine clone-ready distribution from the dev repo",
  "description": "**Origin**: end-to-end verification this session. We cloned the live dev repo to a temp dir, `npm install`ed, and ran `node bin/init.js`. The created-branch flow works — it archived the 16 framework dev tickets to `.framework-history/`, wrote a fresh PROJECT.md, generated `.claude/agents/project-context.md`, seeded a 3-ticket starter backlog, and repointed `state/session.json` to a new bundle. **So the clone→init path is functional.** But distributing the live dev repo as the template leaves residue the runtime archiver does NOT clean:\n\n1. **`.md` sidecars survive.** `archiveFrameworkHistory` (src/framework-history.js) only moves files matching `^TASK-\\d{3,}\\.json$`. After init, `tasks/TASK-004.research.md` and `tasks/TASK-004.test-runtime-proposal.md` were still sitting in the new project's `tasks/` directory.\n2. **The dev session bundle lingers.** `state/sessions/20260524T000000Z-65fa92c6/` — carrying the entire framework dev history (20+ decisions, the TASK-018 handoff) — stays on disk. init's `startSession` correctly repoints the pointer to a fresh bundle, so it's harmless clutter, but the new project ships with the framework's dev brain in `state/`.\n3. The committed `state/session.json` pointer references that dev bundle until init runs. Harmless (the First-chat routing guard catches the absent PROJECT.md and sends the operator to init before RESUME FIRST would load the stale handoff), but it's stale-on-clone.\n\nThe runtime archiver is a **safety net**, not a clean-slate mechanism. The proper fix is an **upstream template-prep step** that brings a distribution copy to pristine state BEFORE it is pushed/cloned, so init's created branch runs with nothing to archive. This ticket builds that step.\n\n**Scope**: a new `bin/make-template.js` exporting `makeTemplate({ repoRoot, now, apply })`, testable in isolation (injected deps, no implicit process.cwd / Date.now). It must be SAFE-BY-DEFAULT — a careless run must not nuke the live dev repo's git-tracked history. Default invocation is a dry-run that reports the plan; mutation requires an explicit `--yes` flag (`apply: true`).\n\n**Pristine template end-state** (what `apply: true` produces):\n- `tasks/` contains exactly `schema.json`, `README.md`, and an empty `index.json` (`{ generated_at: now(), tasks: [] }`). All `TASK-NNN.json` AND all `TASK-*` sidecars (`TASK-004.research.md`, `TASK-004.test-runtime-proposal.md`, any future `TASK-NNN.*`) are removed. This closes the archiver `.md`-sidecar gap (#1) at the source.\n- `state/session.json` reset to `{ schema_version: 2, active_session_id: null, updated_at: now() }`; `state/sessions/` emptied of all bundle directories. Closes the lingering-bundle leftover (#2) and stale-pointer (#3).\n- `PROJECT.md` and `.claude/agents/project-context.md` removed if present (both are per-project, regenerated by init).\n- LEFT UNTOUCHED: the four base agent files (`developer.md`, `reviewer.md`, `researcher.md`, `orchestrator.md`), `knowledge/` entries (cross-project reusable lessons per TASK-004 design — these are an asset, not residue), `src/`, `bin/`, `tests/`, `CLAUDE.md`, `README.md`, and all framework infrastructure.\n- `.framework-history/` is NOT created — this is the upstream alternative to archiving, not a second archive.\n\n**Out of scope (note for a possible follow-up):** patching the runtime archiver's two gaps directly (sweep `.md` sidecars in `archiveFrameworkHistory`; retire the stale bundle on init). Those harden the safety-net path for operators who clone a non-template repo. This ticket fixes the distribution at the source instead; if we also want the safety net hardened, spawn a separate follow-up rather than widening this one.",
  "acceptance_criteria": [
    "New `bin/make-template.js` exports `makeTemplate({ repoRoot, now, apply })` with injected `now` and `repoRoot` (no implicit `process.cwd()` / `Date.now()` in the exported function). The CLI shell maps `--yes` to `apply: true` and rejects unknown argv tokens, matching bin/init.js / bin/new-task.js strictness.",
    "Default invocation (`apply: false`, no `--yes`) performs ZERO filesystem mutations and returns/prints a plan enumerating every file/dir it would remove or rewrite. A test asserts the repo is byte-identical before and after a dry-run, and that the plan lists the expected targets.",
    "After `apply: true`, `tasks/` contains exactly `schema.json`, `README.md`, and `index.json`; `index.json` equals `{ generated_at: now(), tasks: [] }` (newline-terminated, via atomicWriteFile). No `TASK-NNN.json` and no `TASK-*` sidecar files (e.g. `TASK-004.research.md`) remain. Test pre-seeds both a `.json` ticket and a `.research.md` sidecar and asserts both are gone.",
    "After `apply: true`, `state/session.json` equals `{ schema_version: 2, active_session_id: null, updated_at: now() }` and `state/sessions/` contains no bundle directories. Test pre-seeds a dummy bundle dir and asserts it is removed.",
    "After `apply: true`, `PROJECT.md` and `.claude/agents/project-context.md` do not exist, while `.claude/agents/{developer,reviewer,researcher,orchestrator}.md` and every `knowledge/` entry are left untouched (test asserts the base agents and KB files survive byte-for-byte).",
    "End-to-end guard: in a tmp repo, run `makeTemplate({ apply: true })`, then a scripted `runInit` in the created branch. Assert the archive prompt does NOT fire (countFrameworkHistory returns 0 — no `TASK-NNN.json` present) and init completes with a fresh PROJECT.md + a seeded starter backlog. Proves the template is genuinely clone-ready.",
    "README quickstart gains a short \"Preparing a distribution\" note documenting `node bin/make-template.js --yes` as the step to run before publishing a clone-ready copy, and that consumers must `npm install` before `node bin/init.js` (the init dependency chain needs ajv via backlog-seeder → task-store)."
  ],
  "status": "done",
  "priority": "medium",
  "labels": [
    "distribution",
    "tooling",
    "dx"
  ],
  "assignee": "developer",
  "depends_on": [],
  "linked_commits": [
    "0d7ce87",
    "153a8f0"
  ],
  "linked_prs": [],
  "comments": [
    {
      "author": "orchestrator",
      "at": "2026-05-28T20:45:00Z",
      "body": "Created from a live end-to-end clone test this session. Confirmed the clone→npm install→`node bin/init.js` flow works (state: created, framework tickets archived, PROJECT.md + seeded backlog produced). The ticket fixes distribution residue at the source rather than leaning on the runtime archiver safety net. Two concrete leftovers drove this: (1) `archiveFrameworkHistory` only moves `TASK-NNN.json`, so `tasks/TASK-004.research.md` + `tasks/TASK-004.test-runtime-proposal.md` survived into the fresh project; (2) the dev session bundle `state/sessions/20260524T000000Z-65fa92c6/` lingered (pointer was correctly repointed to a fresh bundle, so harmless, but present). Also surfaced: init is NOT runnable on a bare clone — its dep chain (backlog-seeder → task-store → ajv) requires `npm install` first; captured as AC7 README note. Out-of-scope archiver-gap hardening noted in the description for a possible follow-up; not folded in to keep this ticket single-concern."
    },
    {
      "author": "reviewer",
      "at": "2026-05-28T21:35:00Z",
      "body": "Verdict (fresh context): APPROVE. 0 HIGH / 0 MEDIUM / 0 LOW / 2 NIT. 206/206 vitest specs pass deterministically across two clean runs (10.68s, 10.65s). All 7 ACs COVERED by real, falsifiable on-disk assertions, each verified to be satisfied by the impl. Tests-first discipline confirmed — `git diff 0d7ce87^..153a8f0 -- tests/` is empty. Safety-critical checks: (a) `apply:false` dry-run performs ZERO filesystem mutation (early return before any rmSync/atomicWriteFile + byte-identity snapshot test); (b) `computeTargets()` is the single source of truth — the dry-run plan and the apply loop consume the same arrays so the plan cannot drift from execution; (c) both JSON rewrites are exact-byte (pinned key order, 2-space, trailing \\n) via atomicWriteFile; (d) base agents + knowledge/ never enumerated or swept. NIT-1: `TASK_RESIDUE_RE=/^TASK-/` is broader than the archiver's `^TASK-\\d{3,}\\.json$` but confirmed safe — scoped to tasks/ only, which is meant to ship empty; deliberate clean-slate choice. NIT-2: README prose softer than naming the four base agent files explicitly — purely cosmetic, AC7 test requirements all met. Both NITs deferred without follow-up. Out-of-scope runtime-archiver gaps correctly left alone."
    },
    {
      "author": "orchestrator",
      "at": "2026-05-28T21:40:00Z",
      "body": "Closed on reviewer APPROVE with explicit human go-ahead (ticket-close gate per CLAUDE.md principle #4). Linked commits: 0d7ce87 (test) + 153a8f0 (impl). Delivers `bin/make-template.js` exporting `makeTemplate({repoRoot, now, apply})` + `parseArgs` — a safe-by-default (dry-run) upstream template-prep step that brings a distribution copy to pristine clone-ready state, fixing distribution residue at the source rather than relying on the runtime `archiveFrameworkHistory` safety net. The 2 cosmetic NITs (TASK_RESIDUE_RE breadth doc note; README base-agent prose) deferred without a follow-up ticket, consistent with the TASK-013/015/016 close pattern. Backlog returns to a single open ticket: TASK-003 (Jira migration, MCP-blocked)."
    }
  ],
  "created_at": "2026-05-28T20:45:00Z",
  "updated_at": "2026-05-28T21:40:00Z",
  "jira_key": null
}
